[
  {"id":"money-01","domain":"money","number":1,"name":"Measure","tagline":"Track your real ROI—spiritual and material.","reflectionPrompt":"Where is money leaking—and what emotion is behind it?","majorMove":"Do a 15-min review: list last 7 days spend + 1 insight."},
  {"id":"money-02","domain":"money","number":2,"name":"Think","tagline":"Shift to wealth consciousness.","reflectionPrompt":"What belief about wealth is limiting me right now?","majorMove":"Rewrite 3 limiting beliefs into ownership beliefs; read them aloud."},
  {"id":"money-03","domain":"money","number":3,"name":"Feel","tagline":"Heal money emotions.","reflectionPrompt":"What money moment still makes me tense—and why?","majorMove":"Before next purchase: pause 30s, name emotion, then decide."},
  {"id":"money-04","domain":"money","number":4,"name":"Speak","tagline":"Words create your financial world.","reflectionPrompt":"What do I keep saying that becomes true?","majorMove":"Write one money declaration; place it where you’ll see it daily."},
  {"id":"money-05","domain":"money","number":5,"name":"Ask","tagline":"Clarity + prayer + bold requests.","reflectionPrompt":"What do I want specifically—and what fear blocks the ask?","majorMove":"Make one clear ask today (client, mentor, partner, discount, collab)."},
  {"id":"money-06","domain":"money","number":6,"name":"Hold","tagline":"Be the bank—possess without obsession.","reflectionPrompt":"What does “being the bank” look like this month?","majorMove":"Automate a weekly transfer into savings (even tiny)."},
  {"id":"money-07","domain":"money","number":7,"name":"Use","tagline":"Steward capital wisely.","reflectionPrompt":"Which expense could become an investment instead?","majorMove":"Redirect one spending category into skill/tool/asset this week."},
  {"id":"money-08","domain":"money","number":8,"name":"Manifest","tagline":"Identity first, results follow.","reflectionPrompt":"Who must I become to hold what I’m asking for?","majorMove":"Write 5 traits of Future You; act on 1 trait today."},
  {"id":"money-09","domain":"money","number":9,"name":"Attract","tagline":"Magnetize wealth through value and trust.","reflectionPrompt":"Where can I create obvious value this week?","majorMove":"Ship one small value item today (tip, post, template, outreach)."},
  {"id":"money-10","domain":"money","number":10,"name":"Enjoy","tagline":"Celebrate and circulate guilt-free.","reflectionPrompt":"Do I allow myself to enjoy money without shame?","majorMove":"Plan 1 joyful spend + 1 intentional give this week."}
]
