[
  {"id":"life-01","domain":"life","number":1,"name":"Mindset Mastery","tagline":"Resilience and discipline, daily.","reflectionPrompt":"Where do I need more discipline—and what’s the smallest proof today?","majorMove":"Write one Anchor Thought for tough moments; repeat it 3x today."},
  {"id":"life-02","domain":"life","number":2,"name":"Entrepreneurial Skill-Building","tagline":"Turn ideas into income.","reflectionPrompt":"What problem am I excited to solve—and who already has it?","majorMove":"Block 60 minutes and outline one simple offer (who, what, price, next step)."},
  {"id":"life-03","domain":"life","number":3,"name":"Cultural Connection & Identity","tagline":"Roots power the future.","reflectionPrompt":"What part of my heritage gives me strength right now?","majorMove":"Write a 10-line origin story and share it with one trusted person."},
  {"id":"life-04","domain":"life","number":4,"name":"Physical Vitality","tagline":"Energy through movement.","reflectionPrompt":"What movement makes me feel most alive—and why?","majorMove":"Do 15 minutes of movement today and log how you feel after."},
  {"id":"life-05","domain":"life","number":5,"name":"Nutritional Resilience","tagline":"Food as mission fuel.","reflectionPrompt":"What food habit is stealing my energy the most?","majorMove":"Replace one processed item today with a whole-food alternative."},
  {"id":"life-06","domain":"life","number":6,"name":"Digital Wealth Creation","tagline":"Own your creativity online.","reflectionPrompt":"What do I know that could help 100 people this week?","majorMove":"Outline a 1-page digital product: title + 3 benefits + who it’s for."},
  {"id":"life-07","domain":"life","number":7,"name":"Community Connection & Networking","tagline":"Build with your tribe.","reflectionPrompt":"Who are 3 people I should strengthen relationship with this week?","majorMove":"Send 3 genuine check-ins today (no ask, just value)."},
  {"id":"life-08","domain":"life","number":8,"name":"Wisdom & Storytelling","tagline":"Teach from lived experience.","reflectionPrompt":"What lesson did life teach me the hard way that could help others?","majorMove":"Record a 60-second voice note: “Here’s what I learned…”"},
  {"id":"life-09","domain":"life","number":9,"name":"Forgiveness & Gratitude","tagline":"Release weight, rise light.","reflectionPrompt":"What am I still carrying that costs me energy daily?","majorMove":"Write a forgiveness letter (not sent). End: “I release you.”"},
  {"id":"life-10","domain":"life","number":10,"name":"Creative Expression","tagline":"Joy through creation.","reflectionPrompt":"What wants to come through me creatively right now?","majorMove":"Create for 30 minutes uninterrupted; share a tiny snippet."}
]
