[
  {"id":"tech-01","domain":"tech","number":1,"name":"Diaspora Empowerment","tagline":"Creators over consumers.","reflectionPrompt":"Where can diaspora talent reconnect to a real homeland problem?","majorMove":"Invite one diaspora builder into a shared project thread this week."},
  {"id":"tech-02","domain":"tech","number":2,"name":"Mindset Shift & Resilience","tagline":"Turn adversity into strategy.","reflectionPrompt":"What setback can become an asset if I reframe it?","majorMove":"Write a “setback → strategy” note; take 1 action today."},
  {"id":"tech-03","domain":"tech","number":3,"name":"Gamified Education","tagline":"Make learning addictive.","reflectionPrompt":"What skill could become a 7-day quest?","majorMove":"Draft a 7-step quest outline and share it with one person."},
  {"id":"tech-04","domain":"tech","number":4,"name":"Blockchain & Decentralization","tagline":"Restore ownership; remove middlemen.","reflectionPrompt":"What should the community own in this project?","majorMove":"Draft an ownership map (who owns what, and why)."},
  {"id":"tech-05","domain":"tech","number":5,"name":"Community & Collaboration","tagline":"Crews, tribes, DAOs.","reflectionPrompt":"What role do I play best on a team?","majorMove":"Define 3 roles for your project; recruit for 1 role."},
  {"id":"tech-06","domain":"tech","number":6,"name":"Localized AI & Personalization","tagline":"Tech that speaks the rhythm.","reflectionPrompt":"What local language/story must the AI understand?","majorMove":"Write 10 local examples/phrases your AI should recognize."},
  {"id":"tech-07","domain":"tech","number":7,"name":"Holistic Wellness & Balance","tagline":"Scale without burnout.","reflectionPrompt":"What boundary protects my creativity?","majorMove":"Schedule one non-negotiable recovery block this week."},
  {"id":"tech-08","domain":"tech","number":8,"name":"Security & Compliance","tagline":"Guard sovereignty digitally and legally.","reflectionPrompt":"What data am I collecting that I don’t need?","majorMove":"Remove/stop collecting one unnecessary data field."},
  {"id":"tech-09","domain":"tech","number":9,"name":"Data-Driven Performance & Analytics","tagline":"Track what matters.","reflectionPrompt":"Which metric would prove progress in 30 days?","majorMove":"Pick 3 metrics; set a weekly review ritual."},
  {"id":"tech-10","domain":"tech","number":10,"name":"Legacy & Long-Term Impact","tagline":"Build 100-year dynasties.","reflectionPrompt":"If this runs 10 years, what should it become?","majorMove":"Write a 10-year legacy statement (5 sentences)."}
]
